text,id,sentiment,annotator,annotation_id,created_at,updated_at,lead_time
"@user Não vamos sustentar essa onda de violência contra todos quê negros quê brancos, servidor público ou um simples jornalista feminino ou masculino, todos nós estamos em risco com essa força militar milicianos. ",825611,neutro,1,256,2022-11-13T19:10:44.941571Z,2022-11-13T19:10:44.941571Z,10.099
"@user A cor da pele do Homem negro que é um gigante não importa o importa é se ele ameaçou a deputada negros não tem passe livre para cometer crimes por serem negros, o ato é que importa não a cor da pele .",825610,ofensa,1,255,2022-11-13T19:10:32.415074Z,2022-11-13T19:10:32.415074Z,23.715
"@user Ainda bem q é um vídeo de humor e por algum motivo retardado eu acho humor negro engraçado, então eu mais racho de rir doq tomo susto",825606,ofensa,1,254,2022-11-13T19:10:02.013905Z,2022-11-13T19:10:02.014907Z,8.589
"Mesmo com toda safadeza aqui nordeste, tentando impedir o povo, nós Nordestinos mostramos nossa força! ",825605,neutro,1,253,2022-11-13T19:09:51.892739Z,2022-11-13T19:09:51.892739Z,4.105
"@user @user @user pô faz quase um ano que ele é famoso já deveria ter começado e ele tá estourado faz uns seis meses, já poderia sair um Nice to meet you, ele se comporta igual um RETARDADO só sabe falar receba melhor do mundo graças a Deus vtnc kmmmmmmm",825604,ofensa,1,252,2022-11-13T19:09:45.609599Z,2022-11-13T19:09:45.609599Z,10.147
a incompetente da representante esqueceu de mandar o roteiro de química pros alunos pq tava na rua perambulando igual vagabunda (autocrítica,825603,ofensa,1,251,2022-11-13T19:09:33.513771Z,2022-11-13T19:09:33.513771Z,9.616
"@user @user @user então só que você ser lgbt não é tipo uma cômoda, que você escolhe gostar e se eu não gostar da quw você escolheu posso discordar, você discorda de alguém é negro? você fala que não gosta de negros por que é sua opinião? então mesma coisa, e sim, ele disse pior",825602,neutro,1,250,2022-11-13T19:09:22.311649Z,2022-11-13T19:09:22.311649Z,25.592
Parabéns SP vocês trouxeram os milicianos para as favelas! ,825596,neutro,1,249,2022-11-13T19:08:20.980348Z,2022-11-13T19:08:20.980348Z,2.009
"@user @user Eu continuo a mesma tese. Infelizmente no Brasil o racismo é muito, muito forte mesmo. Tenho amigos negros que mesmo sendo ricos, sofrem com humilhação em diversos momentos...",825594,neutro,1,248,2022-11-13T19:08:15.137671Z,2022-11-13T19:08:15.137671Z,9.793
@user @user Puta vagabunda vadia,825593,ofensa,1,247,2022-11-13T19:08:03.377586Z,2022-11-13T19:08:03.377586Z,1.264
plena segunda feira e essa galera fazendo bagunça na rua depois os mesmos vem dizer que a esquerda que é vagabunda ,825590,neutro,1,246,2022-11-13T19:07:34.749509Z,2022-11-13T19:07:34.749509Z,5.746
"@user Que analogia ruim tchê. Sabes que com os desgovernos petistas sim, éramos escravos da corrupção, má gestão e outros mal feitos. Que pena ver um EX estadista se render ao consórcio do mal. Que o sr recupere a lucidez. Abç.",825589,neutro,1,245,2022-11-13T19:07:26.763266Z,2022-11-13T19:07:26.763266Z,6.242
é retardado quem acaba com amizade por causa de política!,825588,ofensa,1,244,2022-11-13T19:07:18.784006Z,2022-11-13T19:07:18.784006Z,1.264
@user Vai ter o Flash débil mental... Ou o Flash normal?,825587,ofensa,1,243,2022-11-13T19:07:15.680192Z,2022-11-13T19:07:15.680192Z,4.267
"@user @user O fato de vc ser afeminado não impede de reproduzir preconceitos, e por favor não confunde orientação sexual com gênero, pois gay é homem q gosta de homem",825586,neutro,1,242,2022-11-13T19:07:09.387917Z,2022-11-13T19:07:09.387917Z,8.61
Cachorra cadela quenga vadia otaria desgracada imbefil burra DESGRAÇADA VAGABUNDA MAL COMIDA MAL AMADA INFELIZ CU FEDIDO PRIKITO FEDORENTO DE BODTA  azeda podre,825582,discurso_de_odio,1,241,2022-11-13T19:06:37.274021Z,2022-11-13T19:06:37.274021Z,4.408
O descaso só pelo bairro ser de imigrantes e negros ,825581,neutro,1,240,2022-11-13T19:06:31.456906Z,2022-11-13T19:06:31.456906Z,2.348
"@user @user @user @user @user É uma vagabunda, isso sim.",825580,ofensa,1,239,2022-11-13T19:06:27.497729Z,2022-11-13T19:06:27.497729Z,1.034
"@user Perfeita pluralidade com muitos trans, negros, representantes indígenas e mulheres👏👏",825579,neutro,1,238,2022-11-13T19:06:25.054363Z,2022-11-13T19:06:25.054363Z,2.759
@user Filho obeso do Vieira kkkkkk como sabe bem tão bem a CMTV ter esse atrasado mental a destilar ódio ao suposto clube dele. Esse mongoloide sim é o verdadeiro cartilheiro do orelhas,825578,ofensa,1,237,2022-11-13T19:06:20.541145Z,2022-11-13T19:06:20.541145Z,9.199
"Fiquei pensando em vc hj o dia todo, cada lembrança q enchiam meus olhos, sinto falta de quando te encontrava na rua e vc ficava me zoando ou perguntando de alguma amg minha, falando q estava de olho kkkk. Eu nunca vou te esquecer, vai ser pra sempre o gordo safado 👼🏽😓💔 ",825577,neutro,1,236,2022-11-13T19:06:08.682447Z,2022-11-13T19:06:08.682447Z,11.334
"Prisão para os bandidos que impedem os nordestinos de votar. Nunca uma thuthuca do centrão ficou com tanto medo dos nordestinos né Bolsonaro?  Roubando fica fácil ganhar, BOLSONARO COVARDE  DEIXEM O NORDESTE VOTAR",825576,neutro,1,235,2022-11-13T19:05:55.503486Z,2022-11-13T19:05:55.503486Z,9.285
Pior q tem uns retardado q vota... ,825575,ofensa,1,234,2022-11-13T19:05:44.667188Z,2022-11-13T19:05:44.667188Z,3.327
"@user Vc percebeu que os demais aliados, p.e. Ciro Nogueira e Costa Neto, nem se meteram nessa história? Pois é! Mais experientes, já viram que a situação é difícil e não quiseram ser bois de piranha, sobrou para os Fábios. So agora estes perceberam o tamanho do abismo, mas é tarde.",825574,neutro,1,233,2022-11-13T19:05:39.333275Z,2022-11-13T19:05:39.333275Z,12.895
@user Vocês nordestinos vão salvar o Brasil do miliciano e sua trupe .,825573,neutro,1,232,2022-11-13T19:05:24.600259Z,2022-11-13T19:05:24.600259Z,2.312
"@user @user @user Eu vi seu perfil e entendi você, apenas alguém ignorante sem opinião formada, briga e chinga pessoas por motivos banais e ainda por cima um negro como você é racista com outros negros. Deve ser triste defender democracia e fazer exatamente ao contrário com os outros. Intolerância",825572,neutro,1,231,2022-11-13T19:05:20.474852Z,2022-11-13T19:05:20.474852Z,14.432
Se vc tá indeciso e tá vendo a palhaçada que tá acontecendo hoje. Saia de casa e VOTE ainda dar tempo de fazer a diferença ,825569,neutro,1,230,2022-11-13T19:04:52.177335Z,2022-11-13T19:04:52.177335Z,4.714
"@user Eu brocho com isso aqui, e saber que tem retardado que ainda vota no cara...  ",825568,ofensa,1,229,2022-11-13T19:04:45.476295Z,2022-11-13T19:04:45.476295Z,4.257
"@user @user Aliás, @user , algumas seleções são voltadas exclusivamente para mulheres, negros, trans… inclusão social maravilinda!",825565,neutro,1,228,2022-11-13T19:04:34.806158Z,2022-11-13T19:04:34.806158Z,5.501
@user tu apanhou feito aqueles escravos,825566,discurso_de_odio,1,227,2022-11-13T19:04:27.209893Z,2022-11-13T19:04:27.209893Z,1.909
"""É asqueroso notar o quanto é """"impopular"""" lutar contra TODAS AS FORMAS de violência, discriminação e Preconceitos! Por que não lutarmos contra qualquer tipo de crime sem precisar saber qual a Cor, Ideologia ou opção sexual da Vítima?""",825562,neutro,1,226,2022-11-13T19:04:10.356191Z,2022-11-13T19:04:10.356191Z,9.723
"@user Foge mana, são os bolsominion do Sul tentando atrair os nordestinos pra uma armadilha, corre ",825560,neutro,1,225,2022-11-13T19:03:53.643522Z,2022-11-13T19:03:53.643522Z,8.521
"Amigos empresários Muitos estão jogando a culpa nos nordestinos. Não se deixe levar por essa onda. O povo do nordeste é sofrido e trabalhador. Caso a migração para o sudeste tenha uma explosão em números, não exite em empregar pessoas que fogem da seca e da miséria.  Deus abençoe",825559,neutro,1,224,2022-11-13T19:03:42.876001Z,2022-11-13T19:03:42.876001Z,12.744
@user Que negros de m,825555,discurso_de_odio,1,223,2022-11-13T19:03:10.557189Z,2022-11-13T19:03:10.557189Z,1.68
"@user Fantástico! Aqui em Portugal temos uma luta diária para mostrar o quão cruel foi a colonização portuguesa com indígenas e africanos! Só gostaria que sua maravilhosa arte fosse acompanhada de um pouco de posicionamento, como por exemplo, o que você acha do desmanche da FUNAI?..",825554,neutro,1,222,2022-11-13T19:03:06.819954Z,2022-11-13T19:03:06.819954Z,9.289
"@user @user @user Retardado existe aos montes, infelizmente esse é o retrato do Brasil, país que tem os piores políticos, tem os dois piores como favoritos, surreal",825547,ofensa,1,221,2022-11-13T19:02:24.536940Z,2022-11-13T19:02:24.536940Z,4.511
Queria muito ver o Roberto Claudio fazer a virada como o Sarto fez no Capetão em 2020 Mais acho que ele não vai conseguir pq nos interiores só tem povo burro e escravos de partido,825546,ofensa,1,220,2022-11-13T19:02:17.554088Z,2022-11-13T19:02:17.554088Z,6.975
"@user @user Sim amigo, isso é só coincidência, ele não aprovou o pacote anticrime, não flexibilizou o acesso a armas né? os números de homicídios não caíram né? retardado ",825543,ofensa,1,219,2022-11-13T19:02:05.133224Z,2022-11-13T19:02:05.133224Z,5.578
"@user As pessoas não se dão conta que, inconsciente têm aversão a traços faciais de negros, devido aos padrões de beleza eurocentricos. Basta ver o nariz/lábios de mulheres consideradas bonitas.",825542,neutro,1,218,2022-11-13T19:01:57.719239Z,2022-11-13T19:01:57.719239Z,4.691
@user Nossa força e povo pobres negros  trabalhando e os jovens estudantes domingo vamos com Lula 13,825541,neutro,1,217,2022-11-13T19:01:51.199110Z,2022-11-13T19:01:51.199110Z,8.534
"@user @user Chegou no povo retardado com 70 de QI que não sabe de porra nenhuma e nem quer ir atrás saber, só defende por ter virado legalzão chamar os outros de antisemita e eles viram uma thread de esteriótipos contra os judeus oprimidos. Não sabem de absolutamente nada.",825540,ofensa,1,216,2022-11-13T19:01:40.876647Z,2022-11-13T19:01:40.876647Z,20.662
imagina ser preso por causa do demente do bolsonaro ,825539,ofensa,1,215,2022-11-13T19:01:18.132599Z,2022-11-13T19:01:18.132599Z,1.645
@user Sim! Admita!! você é um gordo sujo e peludo na frente do PC   Zoas linda. é claro que tu ñ é fake,825538,ofensa,1,214,2022-11-13T19:01:14.304382Z,2022-11-13T19:01:14.304382Z,6.641
"Nego tem inveja até do pouco que nós tem, tá repreendido, sai pra lá olho gordo! 🧿",825537,neutro,1,213,2022-11-13T19:01:06.037800Z,2022-11-13T19:01:06.037800Z,4.728
"@user Pra isso que criaram o sistema de cotas para negros e quem estudou em escola pública, além de prouni e fies pra quem for pra faculdade privada. Antes somente ricos estudavam em qualquer universidade, seja privada ou pública",825535,neutro,1,212,2022-11-13T19:00:58.423585Z,2022-11-13T19:00:58.423585Z,6.242
Esse calor me obriga a ir no gordo tomar uma gelada haha,825534,neutro,1,211,2022-11-13T19:00:50.402382Z,2022-11-13T19:00:50.402382Z,3.348
Jovens negros se sentem na candelária Jovens brancos tem surtos psicóticos...,825532,neutro,1,210,2022-11-13T19:00:36.189640Z,2022-11-13T19:00:36.190640Z,6.487
"@user Nossa, cara. Falou bobagem faraônica agora. Coitado joga sozinho no ataque desse time ridículo, com esquema tático débil.  Pode apagar esse post numa boa.",825527,neutro,1,209,2022-11-13T19:00:12.477360Z,2022-11-13T19:00:12.477360Z,10.139
@user Felipe neto vai toma no cu esse youtube não tem conteúdo é um retardado si acha gênio,825526,ofensa,1,208,2022-11-13T19:00:00.523685Z,2022-11-13T19:00:00.523685Z,1.948
"Se vc ver bolsonaristas fechando rodovias e ameaçando o povo taca pedr4 nesses BolsoNAZISTAS ou qualquer  outra coisa que vc encontrar pela frente.  Nao podemos deixar essa gente mandar, so pq perderam a mamata estao ai revoltados kkkk   ",825524,discurso_de_odio,1,207,2022-11-13T18:59:55.306313Z,2022-11-13T18:59:55.306313Z,9.091
@user Até os índios estão sendo atrapalhados no cumprimento do dever cívico.,825523,neutro,1,206,2022-11-13T18:59:44.590395Z,2022-11-13T18:59:44.590395Z,5.44
"O mlk é tão branco, que chega ser rosa E ainda por cima é gordo Essa porra é o Majin Boo",825522,ofensa,1,205,2022-11-13T18:59:36.817913Z,2022-11-13T18:59:36.817913Z,3.243
"""@user @user @user @user @user sinceramente moça, vc é uma mulher preta e defensora de um cara que disse que negros não servem sequer pra reproduzir. um cara que já disse que """"um filho dele não se casaria com uma negra pq recebeu educação"""". sem contar das outras 1001 atrocidades q esse lixo falou.""",825520,neutro,1,203,2022-11-13T18:59:19.252881Z,2022-11-13T18:59:19.252881Z,6.572
Eu tenho um ranço destes carrões que ficam rodando as escolas da periferia no dia das eleições.  Pelo carro certeza que vai é daqui. E todo mundo sabe que na maioria das vezes boa coisa tbm não é como por exemplo compra de votos..   ,825519,neutro,1,202,2022-11-13T18:59:11.207489Z,2022-11-13T18:59:11.208487Z,3.416
"Nordestinos que estão cuidando de nós em silêncio,  não desistam, precisamos de vocês, troquem as camisas oque importa hj é a urna, não tenham medo hj pois oque nos espera é muito pior ",825517,neutro,1,201,2022-11-13T18:59:05.106153Z,2022-11-13T18:59:05.106153Z,3.584
"""@user @user Ninguém liga para a opção sexual dele. Mas o fato é. Esses falsos moralistas """"atacam"""" homossexuais diariamente, tanto nas redes sociais, quanto em suas igrejas. Então tem que escancarar a hipocrisia desse povo.""",825515,neutro,1,200,2022-11-13T18:58:59.071011Z,2022-11-13T18:58:59.071011Z,4.884
"@user vc é mto mais do que as pessoas falam, independentemente de qualquer comentário sobre sua opção sexual, se tiver que agradar alguém, que seja a vc",825514,neutro,1,199,2022-11-13T18:58:52.128762Z,2022-11-13T18:58:52.128762Z,5.09
"Claramente a criatura nunca precisou pagar um TED, faz medicina custeada pelos pais e fica falando mal do lula, se enxerga vagabunda!",825508,ofensa,1,198,2022-11-13T18:58:27.190696Z,2022-11-13T18:58:27.190696Z,3.704
"FICOU ATÉ TARDE SECANDO O BOZO??????  🗣️ FIQUEI PIRANHA !!!! O BOZO TOMOU NO CU, SE FUDEU 🖕🖕🖕🖕🖕🖕🖕  💥💥💥💥💥 VAI TOMAR NO CU BOLSONARO 💥💥💥💥💥💥  TOMA NO CUUUUUUUUUUUU 🎶",825507,ofensa,1,197,2022-11-13T18:58:21.416607Z,2022-11-13T18:58:21.416607Z,5.005
"@user C posta isso, vem um olho gordo e, pam, desempregada e sem namorado",825506,neutro,1,196,2022-11-13T18:58:14.230616Z,2022-11-13T18:58:14.230616Z,4.878
"@user Diz Pedro, 31 anos, aluno de filosofia que está no 14° ano da graduação",825505,neutro,1,195,2022-11-13T18:58:07.735958Z,2022-11-13T18:58:07.735958Z,4.469
@user @user @user @user Então você preferia um aumento inflacionário né?,825504,neutro,1,194,2022-11-13T18:58:01.452861Z,2022-11-13T18:58:01.452861Z,4.764
@user Precisa ser bem retardado pra acreditar no falso padre.,825499,ofensa,1,193,2022-11-13T18:57:32.102254Z,2022-11-13T18:57:32.102254Z,2.285
@user Muito triste e decepcionado com essa diretoria que deu a taça na mão do Bolsonaro e agora essa vagabunda diz isso.,825497,ofensa,1,192,2022-11-13T18:57:03.824731Z,2022-11-13T18:57:03.824731Z,3.566
@user Cala sua boca seu gordo asqueroso esquerdista fdpt,825495,ofensa,1,191,2022-11-13T18:56:54.826636Z,2022-11-13T18:56:54.826636Z,3.252
"@user @user @user Te falo o mesmo! Olha o que você defende, olha seu grupo o que faz, atacando os nordestinos, falando que deveriam passar fome. Óbvio que acho o governo uma bosta mas fora isso eu nunca vou de acordo com o que vocês pregam. Isso basta!",825491,neutro,1,190,2022-11-13T18:56:33.297757Z,2022-11-13T18:56:33.297757Z,15.495
Uma tia que sempre reclamou que eu era gordo hoje chegou pra mim e disse que eu estava magro demais ,825488,neutro,1,189,2022-11-13T18:56:01.850856Z,2022-11-13T18:56:01.850856Z,5.695
"@user @user @user Não fala merda, a vida não é só seu mundinho ai no seu quartinho no brasil. Pesquisa ai sobre bairros de negros nos estados unidos aonde se uma pessoa branca entrar e ir em um mercado comprar alguma coisa eles batem só por ser branca.",825484,ofensa,1,188,2022-11-13T18:55:34.790407Z,2022-11-13T18:55:34.790407Z,47.527
"Foi difícil esconder a minha sexualidade por tanto tempo, já que eu nunca me senti confortável Hoje finalmente decidi me assumir publicamente espero que vocês não deixem de serem meus amigos por conta da minha opção sexual. Sim eu sou Neysexual e venero completamente o menino ney",825483,neutro,1,187,2022-11-13T18:54:45.786726Z,2022-11-13T18:54:45.786726Z,2.024
"Passou uma propaganda do PT afirmando q o Haddad fez maravilhas na educação, transformando os brazucas médios praticamente em filósofos.  Mas aí lembrei q o Lula disse q os nordestinos são analfabetos pq  ~ nunca na história desse país ~ um governo se importou com a educação.  🤔",825481,neutro,1,186,2022-11-13T18:54:28.000873Z,2022-11-13T18:54:28.000873Z,8.533
"""@user @user @user Meu braço direito e amigo no trabalho é gay e ele sempre diz que a maior discriminação está entre eles. Assuma, encare desafios e não procure desculpas em raça, cor ou opção sexual, para suas próprias deficiências. Não vitimize-se ou o """"orgulho"""" só estará estampado em """"cartazes""""""",825479,ofensa,1,185,2022-11-13T18:54:13.056988Z,2022-11-13T18:54:13.056988Z,8.056
"""Hj no trabalho, durante um papo sobre as mulheres que assassinaram a sangue frio o filho Rhuan, um cara virou pra mim pra dizer: """"ok que cada um tenha sua OPÇÃO (pleno 2019 e ainda isso) sexual, mas vc não acha que 'esse povo' tem algum tipo de distúrbio?""""""",825478,discurso_de_odio,1,184,2022-11-13T18:54:02.580521Z,2022-11-13T18:54:02.580521Z,46.931
"Meus queridos irmãos nordestinos, vejam como este político se referiu a vocês, não aceito isto de modo algum, tenho sangue cearense em minhas veias, vamos varrer essa gente da política. ",825477,neutro,1,183,2022-11-13T18:53:13.510690Z,2022-11-13T18:53:13.510690Z,3.757
"Eleições e denúncias de operações ilegais.  Devido as inúmeras denúncias, elaborei este vídeo para subir a . Não é admissível o aparelhamento das instituições para dificultar o acesso ao voto!  O voto é direito de todos!    ",825473,neutro,1,182,2022-11-13T18:53:01.900638Z,2022-11-13T18:53:01.900638Z,7.286
"Cada atualizada no meu perfil q eu dou, é menos 3/4 seguidores….. será que isso s um bug? Ou tem uns retardado parando de me seguir mesmo?!",825471,ofensa,1,181,2022-11-13T18:52:51.384149Z,2022-11-13T18:52:51.384149Z,3.671
"@user @user @user @user E inacreditável como existe pessoas que sofrem tanto preconceito pela opção sexual e ainda sim vivem destilando ódio gratuito a empatia só serve pra suas causas? Pra,que serve a democracia ? O direito de ir e vim só serve pra pautas da sua categoria é?",825470,neutro,1,180,2022-11-13T18:52:46.106002Z,2022-11-13T18:52:46.106002Z,9.75
"é pq hj eu vou tacar, na piranha de SP, hj eu vou machucar as vagabunda de SP, fala q é braba na foda e representa no caralho",825469,ofensa,1,179,2022-11-13T18:52:34.620402Z,2022-11-13T18:52:34.620402Z,9.98
@user E se os dois voltarem a futebol americano da década de 1930 sair correndo e lançando igual retardado,825468,ofensa,1,178,2022-11-13T18:52:22.963706Z,2022-11-13T18:52:22.963706Z,3.802
@user @user @user @user E o bolsonaro no podcast cristão falou que a reação contra isso foi exagerada e n teve racismo pq ate negros tavam xingando o aranha,825467,neutro,1,177,2022-11-13T18:52:17.642009Z,2022-11-13T18:52:17.642009Z,7.894
"@user ss eu sei, é q eu tinha acabdo de acordar quando tweetei isso e esqueci de desconjuração, então, é q o cara me vem e fala SÓ personagens negros fica foda né, e da pra ver q o chico n é negro",825466,neutro,1,176,2022-11-13T18:52:07.911593Z,2022-11-13T18:52:07.911593Z,18.967
@user Cala a boca imbecil! Ou e débil mental ou canalha!,825465,ofensa,1,175,2022-11-13T18:51:47.208887Z,2022-11-13T18:51:47.208887Z,4.157
"@user difícil meu caro, muito difícil. agora ficou só o @user e justin bieber pra representar os homens negros desse mundão aí",825460,neutro,1,174,2022-11-13T18:51:23.436588Z,2022-11-13T18:51:23.436588Z,3.629
"@user Meus pais moram em Minas . Minha familia toda em várias cidades só deu Lula . Bolsonarista é mau caráter retardado , só pode",825459,ofensa,1,173,2022-11-13T18:51:18.293451Z,2022-11-13T18:51:18.293451Z,6.641
"@user @user @user @user Esse imbecil não conseguiu se eleger,e agora quer atacar nordestinos pra aliviar sua frustração,a inveja é uma MERRDA...",825458,ofensa,1,172,2022-11-13T18:51:09.991021Z,2022-11-13T18:51:09.991021Z,6.379
"Um país latino-americano onde quase metade da população vota na extrema direita fala muito sobre si mesmo. Os “ricos” e a classe média ñ seriam suficientes p este percentual. Tbm votaram pobres, negros(pretos e pardos), gays, deficientes. Ñ se enxergam! Complexo de superioridade. ",825457,neutro,1,171,2022-11-13T18:51:02.114043Z,2022-11-13T18:51:02.114043Z,4.553
"@user @user Então o vasco sempre foi um clube de inclusão,  sendo racial, opacao sexual, e religião ne, o Lula apoia países q matam cristãos, homossexuais, negros.  Então ser vasco concertaza não é ser PT não é vdd, ser vasvo não é ser bolsonaro tbm, vasco e coisa única de ser",825456,neutro,1,170,2022-11-13T18:50:55.900797Z,2022-11-13T18:50:55.900797Z,3.019
"""O Nordeste Tem o Seu Valor! Direto de Alagoinhas na Bahia. Resposta de dois Nordestinos! Veja o Vídeo na Íntegra e Compartilhe o Link:      Cantamos com letra autoral e melodia da Banda """"Capital Inicial - Primeiros Erros"""". """,825455,neutro,1,169,2022-11-13T18:50:50.544554Z,2022-11-13T18:50:50.544554Z,10.238
"@user nossa amiga, só pensei nisso quando vi o vídeo do feio do Neymar, o tanto de adolescente retardado que ele vai influenciar",825454,ofensa,1,168,2022-11-13T18:50:38.262657Z,2022-11-13T18:50:38.262657Z,4.945
@user esqueci de colocar a opção: d - todos a cima  Mulher o povo falando q a amg q é uma piranha... meu deus nunca vou poder entrar num relacionamento porq isso é ser piranha... fora q ela foi falar logo com a mina... o trauma da gata,825453,neutro,1,167,2022-11-13T18:50:31.561961Z,2022-11-13T18:50:31.561961Z,20.23
"A galera que prometeu ir embora, já foi ?   ",825452,neutro,1,166,2022-11-13T18:50:09.542579Z,2022-11-13T18:50:09.542579Z,2.049
XENOFOBIA REGIONAL  CONTRA NORDESTINOS  Diretora do Flamengo insinua contra nordestinos em post depois de eleição  via @user @user,825450,neutro,1,165,2022-11-13T18:50:01.650564Z,2022-11-13T18:50:01.650564Z,1.509
o bom d ter família macumbeira é q eles fazem trabalho até p mim sarar kkkkkkkkk,825449,neutro,1,164,2022-11-13T18:49:58.264773Z,2022-11-13T18:49:58.264773Z,3.221
"@user @user @user @user Pobre tem que ser oq ele quiser e nao oq idiotas feito vc determinam. Ja passou da hora de vcs entenderem que condição financeira, genero e opção sexual nao é e nunca foi impositivo p posição politica. Cont.",825448,neutro,1,163,2022-11-13T18:49:53.018515Z,2022-11-13T18:49:53.018515Z,21.62
@user @user Opção sexual é a escolha retardado,825447,ofensa,1,162,2022-11-13T18:49:29.603029Z,2022-11-13T18:49:29.603029Z,1.546
"INCLUSIVE ELE É NORDESTINO!! obrigada a todos os nordestinos q ajudaram a tirar esse neonazi do poder, e desculpa pelo povo daqui do sul ser um bando de nojento  ",825446,neutro,1,161,2022-11-13T18:49:23.779365Z,2022-11-13T18:49:23.779365Z,1.461
"@user Alibabá e os 40 ladrões, LulaLadrão seu lugar é na prisão!!! Os Nordestinos foram os mais prejudicados pelo LulaLadrão e seus comparsas. Povo forte e lutador. Nossa irmãos. O Brasil é um só, pare com está tentativa de divisão.",825445,neutro,1,160,2022-11-13T18:49:20.434620Z,2022-11-13T18:49:20.434620Z,1162.443
passo pano para o polo sim a Marina era uma chata fez o certo em ter acabado com a vagabunda e digo mais,825443,ofensa,1,159,2022-11-13T18:29:52.605405Z,2022-11-13T18:29:52.605405Z,5.969
Hoje presenciamos um atentado a democracia.    ,825442,neutro,1,158,2022-11-13T18:29:42.743811Z,2022-11-13T18:29:42.743811Z,1.756
sua velha vagabunda minha vó tbm tinha 14 anos em 64 e ela teve q ver o ser preso e teve q passar o diabo sua desgraçada palhaça vaca puta ,825441,ofensa,1,157,2022-11-13T18:29:38.996767Z,2022-11-13T18:29:38.996767Z,2.992
@user Deve ter comprado o selinho. Nunca vi mais gordo.,825440,ofensa,1,156,2022-11-13T18:29:34.166029Z,2022-11-13T18:29:34.166029Z,3.665
"@user Você tá de brincadeira Frota,muito feio oque você está fazendo! É uma decepção!Se vocês transaram ou não é problema de vocês, não cabe a ficar se expondo.Nada contra a sua opção sexual, mas isso é um jeito característico do Presidente brincar!Cresce cara",825439,neutro,1,155,2022-11-13T18:29:26.555812Z,2022-11-13T18:29:26.555812Z,5.163
Sabe qual foi a maior fraude destas eleições? A mentira da esquerda pra enganar os nordestinos,825438,neutro,1,154,2022-11-13T18:29:19.494672Z,2022-11-13T18:29:19.494672Z,9.44
"Parem de se referir à sexualidade como 'opção sexual', quem em sã consciência opta por gostar de homem? Affs",825437,neutro,1,153,2022-11-13T18:29:08.185796Z,2022-11-13T18:29:08.185796Z,2.285
@user Grande bosta! Ninguém quer saber se fulano e gay ou lésbica. Só queremos saber se é uma boa pessoa. Usar opção sexual para fazer política só mostra que a pessoa é mau caráter!,825436,ofensa,1,152,2022-11-13T18:29:03.804670Z,2022-11-13T18:29:03.804670Z,38.495
"@user Que vergonha para nosso Brasil. Eleitores Índios e presidiários a gente entende, pois estão fora da curva da sociedade. Os demais lulistas são abortistas, usuários de droga, defensores de pequenos delitos, mamadores da grana pública, defensores da teologia da libertação etc! ",825435,discurso_de_odio,1,151,2022-11-13T18:28:23.012694Z,2022-11-13T18:28:23.012694Z,10.719
